Date,URL,News Title,News Abstract,News Content
2024-08-01,https://www.nytimes.com/2024/08/01/arts/music/meshell-ndegeocello-james-baldwin.html,Meshell Ndegeocello Could Have Had Stardom but Chose Music Instead,"The bassist, singer and composer’s 1993 debut jolted the industry — then she decided to change. Now she is releasing a powerful album inspired by James Baldwin.","A good musician’s relationship with the past is tricky. You want to move forward without entirely forsaking what you’ve already done. You don’t want it defining you when so much future defining lies ahead. It’s a dilemma Meshell Ndegeocello was thinking through at her dining room table in Carroll Gardens, Brooklyn, on a recent afternoon."
2024-08-01,https://www.nytimes.com/article/freezer-food-safety.html,"Is It Safe to Refreeze Food? And Other Food Safety Questions, Answered","Shuttling dishes and ingredients from fridge to freezer and back again can be totally fine, as long as you follow some guidelines.","For every thrill in the kitchen — an egg rippling through hot oil, a perfect pancake flip — there comes blank-faced pondering at the fridge: “That salmon I thawed on Monday — can’t I just slip it back into the freezer?"" “Those beans are on their second reheat. What happens if I make it three?”"
2024-08-01,https://www.nytimes.com/2024/08/01/technology/apple-quarterly-revenue-up-5.html,Sales of Macs and iPads Lead Apple’s Quarterly Revenue Up 5%,"While iPhone sales dropped 1 percent, consumer interest in Apple’s flagship product is expected to pick up later this year.","This spring, Apple updated its iPads and Macs with faster processors and new features. The improvements are already paying off."
2024-08-02,https://www.nytimes.com/2024/08/02/business/dealbook/stocks-hard-landing-fed-rates.html,Hard Landing Concerns Jolt Global Markets,Investors are focusing on slowing U.S. economic growth as calls for the Fed to cut interest rates grow louder.,Global markets are a blur of red on Friday as investors fret that the U.S. economy is heading for a slowdown.
2024-08-02,https://www.nytimes.com/interactive/2024/08/02/technology/02tiktok-doj-document.html,Read the lawsuit,The Justice Department said in its legal filing that TikTok had violated a leading child privacy law.,The Justice Department said in its legal filing that TikTok had violated a leading child privacy law.
2024-08-03,https://www.nytimes.com/2024/08/03/opinion/kamala-harris-innovation-technology.html,Why Silicon Valley Should Get Behind Kamala Harris,Her presidency could support the technological innovation our economy needs.,There is a major opportunity for Vice President Kamala Harris and the Democrats in the House and Senate to set our country on a different course.
2024-08-03,https://www.nytimes.com/2024/08/03/business/dealbook/saying-the-quiet-part-out-loud.html,Saying the Quiet Part Out Loud,"Two billionaire Democratic donors have publicly pressured Vice President Kamala Harris to replace the F.T.C. chair, Lina Khan. Wall Street insiders are worried that could backfire.","Wall Street Democrats have spent the last eight years complaining about their relationship with Washington. They found former President Donald Trump’s presidency unpredictable, and then became estranged from the Democratic Party as President Biden hired the most aggressive antitrust regulators in recent memory. But now that Vice President Kamala Harris is the party’s presumptive presidential nominee, they see a chance to regain influence."
2024-08-04,https://www.nytimes.com/2024/08/04/briefing/israel-hamas-hezbollah-myanmar-harris.html,Monday Briefing: A Tense Wait in Israel,"Plus, philanthropy with a dark twist.",
2024-08-05,https://www.nytimes.com/2024/08/05/briefing/kamala-harris-britain-riots-israel.html,Monday Briefing,Kamala Harris’s search for a running mate.,The presidential election is less than 100 days away. This is what we’re watching.
2024-08-06,https://www.nytimes.com/2024/08/06/technology/nvidia-antitrust-scrutiny.html,"As Regulators Close In, Nvidia Scrambles for a Response","With a 90 percent share of the A.I. chip market, the company is facing antitrust investigations into the possibility that it could lock in customers or hurt competitors.","Nvidia rocketed to the top of the tech industry by providing the computer chips essential to building artificial intelligence. By the end of last year, it had more than a 90 percent share of those chips sold around the world."
2024-08-06,https://www.nytimes.com/2024/08/06/podcasts/the-daily/global-stock-market-fears.html,What Just Happened on Wall Street?,"Explaining Monday’s stock-market plunge, and its potential consequences.","Every major U.S. stock market plunged on Monday, wiping out billions of dollars in value."
2024-08-06,https://www.nytimes.com/2024/08/06/business/dealbook/google-antitrust-tech.html,How Google’s Antitrust Defeat Might Transform Big Tech,The search giant is likely to appeal a federal judge’s ruling that it abuses its monopoly in the lucrative online business. But the industry could still see major changes.,"The federal court ruling that Google had abused its monopoly in online search threatens to disrupt one of the most valuable businesses in modern history, and Big Tech more broadly."
2024-08-07,https://www.nytimes.com/2024/08/07/business/stock-market-drama-explained.html,What’s Behind All the Stock Market Drama?,"Analysts and investors have many explanations, including worries about the health of the U.S. economy and shifts in the value of the Japanese yen.",The wild swings in markets recently are a case study in how seemingly distinct pillars around the globe are connected through the financial system — and the domino effect that can follow if one of them falls.
2024-08-07,https://www.nytimes.com/2024/08/07/opinion/kamala-harris-google-antitrust.html,It’s Unclear What Kamala Harris Thinks About Corporate Power. But the Signs Are Worrisome.,Take a look at the people around her.,What does Kamala Harris think about corporate power?
2024-08-07,https://www.nytimes.com/2024/08/07/business/dealbook/walz-economics-business-issues.html,A Walzonomics Primer,"Here’s how business executives and donors are evaluating Gov. Tim Walz of Minnesota, especially on taxes, labor unions, energy policy and more.","It’s been nearly 24 hours since Kamala Harris announced Gov. Tim Walz of Minnesota as her running mate, catapulting him into the national spotlight."
2024-08-09,https://www.nytimes.com/interactive/2024/08/09/briefing/news-quiz-harris-walz-debby-stocks.html,"The New York Times News Quiz, Aug. 9, 2024",Did you follow the news this week? Take our quiz to see how well you stack up with other Times readers.,Did you follow the news this week? Take our quiz to see how well you stack up with other Times readers.
2024-08-09,https://www.nytimes.com/2024/08/09/podcasts/hardfork-google-antitrust-ai-bubble.html,Google’s Monopoly Money + Is the A.I. Bubble Popping? + The Hot-Mess Express,“Maybe this actually is a chance to press the reset button on the internet.”,"This week, a federal judge ruled that Google acted illegally to maintain a monopoly in online search. David McCabe, a New York Times reporter, joins to discuss what happens next. Then, are we in an A.I. bubble? We weigh in on the wild market swings that started the week and consider the argument that A.I. is overhyped. And finally, it’s time for our new segment: We bat around some of the weirdest recent tech drama — including a MrBeast competition that went awry and a founder who dropped a diss track aimed at a rival. All aboard the Hot-Mess Express."
2024-08-10,https://www.nytimes.com/interactive/2024/08/10/us/elections/times-siena-poll-registered-voter-crosstabs.html,"Cross-Tabs: August 2024 Times/Siena Poll of Registered Voters in Michigan, Pennsylvania and Wisconsin","Results of New York Times/Siena College polls of Michigan, Pennsylvania and Wisconsin conducted among 1,973 registered voters from Aug. 5 to 9, 2024.","Results of New York Times/Siena College polls of Michigan, Pennsylvania and Wisconsin conducted among 1,973 registered voters from Aug. 5 to 9, 2024."
2024-08-10,https://www.nytimes.com/interactive/2024/08/10/us/elections/times-siena-poll-likely-electorate-crosstabs.html,"Cross-Tabs: August 2024 Times/Siena Poll of the Likely Electorate in Michigan, Pennsylvania and Wisconsin","Results of New York Times/Siena College polls of Michigan, Pennsylvania and Wisconsin conducted among 1,973 likely voters from Aug. 5 to 9, 2024.","Results of New York Times/Siena College polls of Michigan, Pennsylvania and Wisconsin conducted among 1,973 likely voters from Aug. 5 to 9, 2024."
2024-08-10,https://www.nytimes.com/interactive/2024/08/10/us/elections/times-siena-poll-pennsylvania-toplines.html,Toplines: August 2024 Times/Siena Poll of Registered Voters in Pennsylvania,"Results of a Pennsylvania New York Times/Siena College poll conducted among 693 registered voters from Aug. 6 to 9, 2024.","Results of a Pennsylvania New York Times/Siena College poll conducted among 693 registered voters from Aug. 6 to 9, 2024."
2024-08-10,https://www.nytimes.com/interactive/2024/08/10/us/elections/times-siena-poll-wisconsin-toplines.html,Toplines: August 2024 Times/Siena Poll of Registered Voters in Wisconsin,"Results of a Wisconsin New York Times/Siena College poll conducted among 661 registered voters from Aug. 5 to 8, 2024.","Results of a Wisconsin New York Times/Siena College poll conducted among 661 registered voters from Aug. 5 to 8, 2024."
2024-08-10,https://www.nytimes.com/interactive/2024/08/10/us/elections/times-siena-poll-michigan-toplines.html,Toplines: August 2024 Times/Siena Poll of Registered Voters in Michigan,"Results of a Michigan New York Times/Siena College poll conducted among 619 registered voters from Aug. 5 to 8, 2024.","Results of a Michigan New York Times/Siena College poll conducted among 619 registered voters from Aug. 5 to 8, 2024."
2024-08-10,https://www.nytimes.com/interactive/2024/08/10/us/elections/times-siena-poll-pennsylvania-registered-voters.html,Cross-Tabs: August 2024 Times/Siena Poll of Registered Voters in Pennsylvania,"Results of a Pennsylvania New York Times/Siena College poll conducted among 693 registered voters from Aug. 6 to 9, 2024.","Results of a Pennsylvania New York Times/Siena College poll conducted among 693 registered voters from Aug. 6 to 9, 2024."
2024-08-10,https://www.nytimes.com/interactive/2024/08/10/us/elections/times-siena-poll-michigan-registered-voters.html,Cross-Tabs: August 2024 Times/Siena Poll of Registered Voters in Michigan,"Results of a Michigan New York Times/Siena College poll conducted among 619 registered voters from Aug. 5 to 8, 2024.","Results of a Michigan New York Times/Siena College poll conducted among 619 registered voters from Aug. 5 to 8, 2024."
2024-08-10,https://www.nytimes.com/interactive/2024/08/10/us/elections/times-siena-poll-wisconsin-registered-voters.html,Cross-Tabs: August 2024 Times/Siena Poll of Registered Voters in Wisconsin,"Results of a Wisconsin New York Times/Siena College poll conducted among 661 registered voters from Aug. 5 to 8, 2024.","Results of a Wisconsin New York Times/Siena College poll conducted among 661 registered voters from Aug. 5 to 8, 2024."
2024-08-10,https://www.nytimes.com/interactive/2024/08/10/us/elections/times-siena-poll-pennsylvania-likely-electorate.html,Cross-Tabs: August 2024 Times/Siena Poll of the Likely Electorate in Pennsylvania,"Results of a Pennsylvania New York Times/Siena College poll conducted among 693 likely voters from Aug. 6 to 9, 2024.","Results of a Pennsylvania New York Times/Siena College poll conducted among 693 likely voters from Aug. 6 to 9, 2024."
2024-08-10,https://www.nytimes.com/interactive/2024/08/10/us/elections/times-siena-poll-michigan-likely-electorate.html,Cross-Tabs: August 2024 Times/Siena Poll of the Likely Electorate in Michigan,"Results of a Michigan New York Times/Siena College poll conducted among 619 likely voters from Aug. 5 to 8, 2024.","Results of a Michigan New York Times/Siena College poll conducted among 619 likely voters from Aug. 5 to 8, 2024."
2024-08-10,https://www.nytimes.com/interactive/2024/08/10/us/elections/times-siena-poll-wisconsin-likely-electorate.html,Cross-Tabs: August 2024 Times/Siena Poll of the Likely Electorate in Wisconsin,"Results of a Wisconsin New York Times/Siena College poll conducted among 661 likely voters from Aug. 5 to 8, 2024.","Results of a Wisconsin New York Times/Siena College poll conducted among 661 likely voters from Aug. 5 to 8, 2024."
2024-08-11,https://www.nytimes.com/2024/08/11/health/maternal-mortality-mississippi.html,What Killed Harmony Ball-Stribling?,One woman’s death reveals the myriad ways in which social and economic factors endanger pregnant women in the United States.,"The last day Byron Stribling spent with his wife, Harmony, was the Fourth of July in 2021. A great day, he always says."
2024-08-12,https://www.nytimes.com/2024/08/12/business/dealbook/stocks-inflation-cpi-earnings.html,Investors Brace for Another Big Week,A new batch of inflation data and earnings from major retailers will again put the spotlight on consumer confidence and economic growth.,"A sense of calm has returned to global markets on Monday, but the economic conditions that triggered last week’s roller coaster swings are still on many minds ahead of a pivotal week."
2024-08-13,https://www.nytimes.com/2024/08/13/opinion/ezra-klein-podcast-nate-silver.html,Nate Silver on Kamala Harris’s Chances and the Mistakes of the ‘Indigo Blob’,The election forecaster discusses 2024 and what politicians can learn from gamblers.,"Nate Silver came to fame in American politics for election forecasting. But before Silver was in politics, he was a poker player. And after getting into politics, he went back to being a poker player. He’s been running through poker championships and out there on tables — partly because he’s been writing a book about risk."
2024-08-14,https://www.nytimes.com/2024/08/14/business/dealbook/google-stock-antitrust-break-up.html,Google’s Stock Falls as the Government Weighs Breaking Up the Company,The Justice Department could force the technology group to split after a landmark court ruling that the search giant is an illegal monopoly.,"Shares in Alphabet, Google’s parent company, were down more than 2.5 percent in early trading on Wednesday morning on news that the Justice Department is considering breaking up the technology giant for maintaining an illegal search monopoly."
2024-08-15,https://www.nytimes.com/2024/08/15/business/weride-china-ipo-nasdaq.html,A Chinese Self-Driving Start-Up Is About to Go Public in the U.S.,"WeRide, a $5 billion software maker, is set for an I.P.O. amid geopolitical risks and a rush by Chinese automotive tech firms to raise money in the United States.","One of China’s leading autonomous driving start-ups is set to go public in New York as soon as this week, with the strained relationship between Beijing and Washington lurking in the background."
2024-08-15,https://www.nytimes.com/interactive/2024/08/15/travel/things-to-do-provincetown.html,"36 Hours in Provincetown, Mass.","P-town offers overlapping identities: one of America’s oldest art colonies, nature preserve, thriving L.G.B.T.Q. resort and historic Portuguese fishing village.","P-town offers overlapping identities: one of America’s oldest art colonies, nature preserve, thriving L.G.B.T.Q. resort and historic Portuguese fishing village."
2024-08-15,https://www.nytimes.com/2024/08/15/t-magazine/gare-de-lyon-paris-restaurant-marius.html,A Sunny New Restaurant in a Parisian Train Station,"Plus: skin care inspired by Belize, a Los Angeles designer’s denim collection and more recommendations from T Magazine.","“I’m So Happy You Are Here: Japanese Women Photographers from the 1950s to Now,” a new book published by Aperture, features wide-ranging portfolios by 25 photographers. As Pauline Vermare, a co-editor of the book, writes in her introductory essay, the primary focus of the women showcased in the book “has been, and remains, to find the means to be independent and represent their own experiences and views of the world.” Among the works included are those by the 77-year-old photographer Miyako Ishiuchi, who co-founded a photography magazine, main, in 1996. The book contains photos from “Yokosuka Story,” a 1970s series focusing on her hometown, the location of a major U.S. Navy base, and a still-life of a lipstick, part of her “Mother’s” (2000-2005) series, for which she photographed her deceased mother’s possessions. One of the youngest photographers in the book, Momo Okabe, 43, trains her lens on her own body and those of her friends, capturing both everyday experiences and life-changing events such as gender-affirming surgery and pregnancy. From photojournalism to works of collage, the book, as its introduction states, “lays the groundwork for understanding the enormity of what has been overlooked.” “I’m So Happy You Are Here” is out on Sept. 17, $75, aperture.org."
2024-08-15,https://www.nytimes.com/2024/08/15/business/dealbook/economy-inflation-election.html,The Economy Moves to Center Stage in the Election,Inflation is cooling but hiring is slowing as Kamala Harris and Donald Trump fine tune their pitch to voters.,"As Vice President Kamala Harris hits the road to start spelling out her economic agenda, she could point to recent progress in the inflation fight that has hounded the Biden administration and Democrats for the past two years."
2024-08-17,https://www.nytimes.com/interactive/2024/08/17/us/elections/times-siena-poll-likely-electorate-crosstabs.html,"Cross-Tabs: August 2024 Times/Siena Poll of the Likely Electorate in Arizona, Georgia, Nevada and North Carolina","Results of an Arizona, Georgia, Nevada and North Carolina New York Times/Siena College poll conducted among 2,670 likely voters from Aug. 8 to 15, 2024.","Results of an Arizona, Georgia, Nevada and North Carolina New York Times/Siena College poll conducted among 2,670 likely voters from Aug. 8 to 15, 2024."
2024-08-17,https://www.nytimes.com/interactive/2024/08/17/us/elections/times-siena-poll-registered-voter-crosstabs.html,"Cross-Tabs: August 2024 Times/Siena Poll of Registered Voters in Arizona, Georgia, Nevada and North Carolina","Results of an Arizona, Georgia, Nevada and North Carolina New York Times/Siena College poll conducted among 2,670 registered voters from Aug. 8 to 15, 2024.","Results of an Arizona, Georgia, Nevada and North Carolina New York Times/Siena College poll conducted among 2,670 registered voters from Aug. 8 to 15, 2024."
2024-08-17,https://www.nytimes.com/interactive/2024/08/17/us/elections/times-siena-poll-arizona-toplines.html,Toplines: August 2024 Times/Siena Poll of Registered Voters in Arizona,"Results of an Arizona New York Times/Siena College poll conducted among 677 registered voters from Aug. 8 to 15, 2024.","Results of an Arizona New York Times/Siena College poll conducted among 677 registered voters from Aug. 8 to 15, 2024."
2024-08-17,https://www.nytimes.com/interactive/2024/08/17/us/elections/times-siena-poll-arizona-registered-voters.html,Cross-Tabs: August 2024 Times/Siena Poll of Registered Voters in Arizona,"Results of an Arizona New York Times/Siena College poll conducted among 677 registered voters from Aug. 8 to 15, 2024.","Results of an Arizona New York Times/Siena College poll conducted among 677 registered voters from Aug. 8 to 15, 2024."
2024-08-17,https://www.nytimes.com/interactive/2024/08/17/us/elections/times-siena-poll-arizona-likely-electorate.html,Cross-Tabs: August 2024 Times/Siena Poll of the Likely Electorate in Arizona,"Results of an Arizona New York Times/Siena College poll conducted among 677 likely voters from Aug. 8 to 15, 2024.","Results of an Arizona New York Times/Siena College poll conducted among 677 likely voters from Aug. 8 to 15, 2024."
2024-08-17,https://www.nytimes.com/interactive/2024/08/17/us/elections/times-siena-poll-georgia-toplines.html,Toplines: August 2024 Times/Siena Poll of Registered Voters in Georgia,"Results of a Georgia New York Times/Siena College poll conducted among 661 registered voters from Aug. 9 to 14, 2024.","Results of a Georgia New York Times/Siena College poll conducted among 661 registered voters from Aug. 9 to 14, 2024."
2024-08-17,https://www.nytimes.com/interactive/2024/08/17/us/elections/times-siena-poll-georgia-likely-electorate.html,Cross-Tabs: August 2024 Times/Siena Poll of the Likely Electorate in Georgia,"Results of a Georgia New York Times/Siena College poll conducted among 661 likely voters from Aug. 9 to 14, 2024.","Results of a Georgia New York Times/Siena College poll conducted among 661 likely voters from Aug. 9 to 14, 2024."
2024-08-17,https://www.nytimes.com/interactive/2024/08/17/us/elections/times-siena-poll-georgia-registered-voters.html,Cross-Tabs: August 2024 Times/Siena Poll of Registered Voters in Georgia,"Results of a Georgia New York Times/Siena College poll conducted among 661 registered voters from Aug. 9 to 14, 2024.","Results of a Georgia New York Times/Siena College poll conducted among 661 registered voters from Aug. 9 to 14, 2024."
2024-08-17,https://www.nytimes.com/interactive/2024/08/17/us/elections/times-siena-poll-nevada-toplines.html,Toplines: August 2024 Times/Siena Poll of Registered Voters in Nevada,"Results of a Nevada New York Times/Siena College poll conducted among 677 registered voters from Aug. 12 to 15, 2024.","Results of a Nevada New York Times/Siena College poll conducted among 677 registered voters from Aug. 12 to 15, 2024."
2024-08-17,https://www.nytimes.com/interactive/2024/08/17/us/elections/times-siena-poll-nevada-registered-voters.html,Cross-Tabs: August 2024 Times/Siena Poll of Registered Voters in Nevada,"Results of a North Carolina New York Times/Siena College poll conducted among 677 registered voters from Aug. 12 to 15, 2024.","Results of a North Carolina New York Times/Siena College poll conducted among 677 registered voters from Aug. 12 to 15, 2024."
2024-08-17,https://www.nytimes.com/interactive/2024/08/17/us/elections/times-siena-poll-nevada-likely-electorate.html,Cross-Tabs: August 2024 Times/Siena Poll of the Likely Electorate in Nevada,"Results of a Nevada New York Times/Siena College poll conducted among 677 likely voters from Aug. 12 to 15, 2024.","Results of a Nevada New York Times/Siena College poll conducted among 677 likely voters from Aug. 12 to 15, 2024."
2024-08-17,https://www.nytimes.com/interactive/2024/08/17/us/elections/times-siena-poll-north-carolina-toplines.html,Toplines: August 2024 Times/Siena Poll of Registered Voters in North Carolina,"Results of a North Carolina New York Times/Siena College poll conducted among 655 registered voters from Aug. 9 to 14, 2024.","Results of a North Carolina New York Times/Siena College poll conducted among 655 registered voters from Aug. 9 to 14, 2024."
2024-08-17,https://www.nytimes.com/interactive/2024/08/17/us/elections/times-siena-poll-north-carolina-registered-voters.html,Cross-Tabs: August 2024 Times/Siena Poll of Registered Voters in North Carolina,"Results of a North Carolina New York Times/Siena College poll conducted among 655 registered voters from Aug. 9 to 14, 2024.","Results of a North Carolina New York Times/Siena College poll conducted among 655 registered voters from Aug. 9 to 14, 2024."
2024-08-17,https://www.nytimes.com/interactive/2024/08/17/us/elections/times-siena-poll-north-carolina-likely-electorate.html,Cross-Tabs: August 2024 Times/Siena Poll of the Likely Electorate in North Carolina,"Results of a North Carolina New York Times/Siena College poll conducted among 655 likely voters from Aug. 9 to 14, 2024.","Results of a North Carolina New York Times/Siena College poll conducted among 655 likely voters from Aug. 9 to 14, 2024."
2024-08-17,https://www.nytimes.com/2024/08/17/style/alex-karp-palantir.html,Alex Karp Has Money and Power. So What Does He Want?,"In a rare in-depth interview, this billionaire man of mystery, the head of Palantir Technologies, talks about war, A.I. and America’s future.",Alex Karp never learned to drive.
2024-08-17,https://www.nytimes.com/2024/08/17/business/dealbook/dnc-democratic-party-money-machine.html,The Democratic Party’s Money Machine,"The Democratic National Committee is again raising huge sums from donors, but the rise of super PACs has forced it to adapt to a new era of big-money influence.","The Democratic National Convention starts on Monday in Chicago, capping an extraordinary few weeks since Vice President Kamala Harris became the party’s presidential candidate."
2024-08-20,https://www.nytimes.com/2024/08/20/business/myron-e-ullman-iii-dead.html,"Myron E. Ullman III, Executive Who Remade Macy’s and J.C. Penney, Dies at 77","As a leader behind many of the world’s best-known brands, he exuded operational know-how. He also displayed a rare humility, which helped drive his success.","Myron E. Ullman III, the unassuming retail executive who gave Macy’s a strategic makeover, revitalized J.C. Penney during two stints as chief executive, and held key positions at Starbucks and the French conglomerate LVMH, died on Aug. 6 in Grand Junction, Colo. He was 77."
2024-08-22,https://www.nytimes.com/2024/08/22/well/cancer-diagnosis-oncologist.html,How to Choose an Oncologist,"After a cancer diagnosis, it’s one of the most important decisions you’ll make.","After a career as a golf professional in southeastern New Mexico, Doug Lyle, 76, decided he had somewhere better to be than on the course: spending time with his new grandchild. Then this summer, just as he was settling into retirement, he learned he had prostate cancer."
