Date,URL,News Title,News Abstract,News Content
2024-08-23,https://www.nytimes.com/2024/08/23/opinion/kamala-harris-speech-democratic-convention.html,What We Learned About Harris — and the Democrats — This Week,The hosts argue Kamala Harris’s speech was a “joyful but not transformational” moment for the Democrats.,"The hosts react to Kamala Harris’s convention speech in this special late-night edition of “Matter of Opinion.” Columnists Lydia Polgreen, Ross Douthat and Carlos Lozada unpack how Harris had a “deft threading of a number of tricky needles” as she accepted her party’s nomination, and look at what the entire week revealed about the Democratic Party."
2024-08-24,https://www.nytimes.com/2024/08/24/technology/elon-musk-twitter-blue.html,How Elon Musk Got Tangled Up in Blue,"Twitter Blue, a revamped subscription service that let users buy verified badges, was the first big test for the platform’s new owner. It didn’t go well.","By Nov. 9, 2022, anxiety was high among the Twitter employees gathered at the company’s San Francisco headquarters. They had spent part of that morning trying to gently explain to their new boss, Elon Musk, that the service they had just launched was dangerous."
2024-08-27,https://www.nytimes.com/2024/08/27/opinion/google-monopoly-ruling-break-up.html,Breaking Up Google Isn’t Nearly Enough,"To end Google’s monopoly on search, the company should be required to disgorge its data on what we’re searching for.","Have you looked for a recipe online? If so, you probably found yourself on a blinking hellscape of a web page that was as long as an epic poem, but without any of the insight. First, you get the hokey story about the recipe’s origin. Then there are the videos. The irrelevant ads. The photos of each ingredient. The thousands of words are divided up into sections with headlines like, “Chia Seed Pudding Troubleshooting.”"
2024-08-28,https://www.nytimes.com/2024/08/28/business/berkshire-hathaway-trillion-market-cap.html,Warren Buffett’s Berkshire Hathaway Hits $1 Trillion in Market Value,The conglomerate joined a small club of companies that have crossed the mark.,"Warren E. Buffett’s Berkshire Hathaway climbed past a market valuation of $1 trillion on Wednesday, joining a small club of mammoth companies dominated by tech firms like Nvidia and Microsoft."
2024-08-28,https://www.nytimes.com/2024/08/28/technology/nvidia-earnings-ai-stocks.html,Nvidia Revenue Jumps 122% in Positive Sign for Tech’s A.I. Boom,Expectations for the chipmaker have been through the roof because of its dominance in a key component for artificial intelligence systems.,"This summer, Wall Street and Silicon Valley began to question whether generative artificial intelligence could produce enough benefits to justify its staggering costs."
2024-09-02,https://www.nytimes.com/2024/09/02/business/coffee-wars-arms-race-starbucks.html,"A Funnel Cake Macchiato, Anyone? The Coffee Wars Are Heating Up.","From the giant Starbucks to upstarts like Scooter’s Coffee in Nebraska, the battle is joined for who can come up with the craziest, calorie-laden, not-really-coffee drink.","Six years ago, Odessa, an oil town in West Texas probably best known for the high school football team that inspired “Friday Night Lights,” had all of 17 coffee or tea restaurants."
2024-09-03,https://www.nytimes.com/2024/09/03/business/dealbook/founder-mode-chesky-graham.html,Why Silicon Valley Is Abuzz Over ‘Founder Mode’,"A debate is brewing among investors and entrepreneurs: Are hands-on founders, such as Steve Jobs and Brian Chesky of Airbnb, the key to start-up success?","Silicon Valley has been abuzz in recent days over one topic in particular: How hands-on should founders be in their companies? In the framing of Brian Chesky, the Airbnb co-founder and C.E.O., and Paul Graham, the Y Combinator co-founder, it comes down to “founder mode” versus “manager mode.”"
2024-09-04,https://www.nytimes.com/2024/09/04/opinion/trump-north-carolina-election.html,Will North Carolina’s MAGA Extremists Doom Trump?,There’s a whiff of Republican panic in this battleground state.,Donald Trump was in North Carolina just two weeks ago. And a week before that. And on Friday he’ll be back. Again. It seems he can’t get enough of my state.
2024-09-06,https://www.nytimes.com/2024/09/06/opinion/conservatives-election-vote-trump-harris.html,Two Christian Conservatives Debate the Merits of Voting for Kamala Harris,Ross Douthat goes head-to-head with his fellow columnist David French over how to move Republicans past Trump.,"Opinion columnist David French is voting for Kamala Harris to save conservatism. The “Matter of Opinion” host Ross Douthat is … skeptical. On this very special episode of “Matter of Opinion,” the two Christian conservatives debate how to chart the right’s course out of Trumpism and to the future."
2024-09-06,https://www.nytimes.com/2024/09/06/business/carl-icahn-investors-wall-street.html,Wall Street Is Worried About Carl Icahn,The value of the 88-year-old activist investor’s company has fallen by nearly $20 billion. Mr. Icahn said that he was “absolutely not selling.”,"Chief executives of public companies have long feared Carl C. Icahn. The 88-year-old investor made a name and billions for himself by questioning the decisions and strategies of corporate leaders and agitating for change at companies like Apple, RJR Nabisco and Netflix."
2024-09-06,https://www.nytimes.com/2024/09/06/books/review/podcast-interview-kate-atkinson-jackson-brodie.html,Kate Atkinson on the Return of Her Detective Hero,“Death at the Sign of the Rook” is the sixth novel in Atkinson’s Jackson Brodie mystery series. What keeps her coming back?,"The British writer Kate Atkinson has had a rich and varied career since her debut novel, “Behind the Scenes at the Museum,” won the Whitbread Book of the Year award in 1996; her 14 subsequent books have included story collections, historical fiction and an inventive speculative novel, “Life After Life,” that won the Costa Novel Award and landed on the Book Review’s recent survey of the 100 Best Books of the 21st Century."
2024-09-08,https://www.nytimes.com/2024/09/08/business/media/disney-bob-iger-chapek.html,The Palace Coup at the Magic Kingdom,"The inside story of how Bob Iger undermined and outmaneuvered Bob Chapek, his chosen successor, and returned to power at Disney.","At 5 p.m. on Feb. 25, 2020, Bob Chapek and Bob Iger settled into matching directors’ chairs on the Disney studio lot for a series of live media interviews. The company had just shocked pretty much everybody by announcing that the little-known Mr. Chapek would be replacing the wildly popular Mr. Iger as chief executive."
2024-09-08,https://www.nytimes.com/interactive/2024/09/08/us/politics/times-siena-poll-toplines.html,Toplines: September 2024 Times/Siena Poll of Registered Voters Nationwide,"Results of a nationwide New York Times/Siena College poll conducted among 1,695 registered voters from September 3 to 6, 2024.","Results of a nationwide New York Times/Siena College poll conducted among 1,695 registered voters from September 3 to 6, 2024."
2024-09-08,https://www.nytimes.com/interactive/2024/09/08/us/politics/times-siena-poll-likely-electorate-crosstabs.html,Cross-Tabs: September 2024 Times/Siena Poll of the Likely Electorate,"Results of a nationwide New York Times/Siena College poll conducted among 1,695 likely voters from September 3 to 6, 2024.","Results of a nationwide New York Times/Siena College poll conducted among 1,695 likely voters from September 3 to 6, 2024."
2024-09-08,https://www.nytimes.com/interactive/2024/09/08/us/politics/times-siena-poll-registered-voter-crosstabs.html,Cross-Tabs: September 2024 Times/Siena Poll of Registered Voters Nationwide,"Results of a nationwide New York Times/Siena College poll conducted among 1,695 registered voters from September 3 to 6, 2024.","Results of a nationwide New York Times/Siena College poll conducted among 1,695 registered voters from September 3 to 6, 2024."
2024-09-09,https://www.nytimes.com/2024/09/09/technology/apple-iphone-ai-features.html,Can Apple’s iPhones Pass the A.I. Test?,"On Monday, the company will introduce smartphones with A.I. features that could take the technology mainstream or sow fresh doubts about its viability.","Shortly before Steve Jobs’s death in 2011, Apple filled a cramped auditorium in Cupertino, Calif., for the unveiling of its fifth iPhone. The device’s biggest selling point was a new software feature called Siri, which helped cause a jump in iPhone sales."
2024-09-09,https://www.nytimes.com/2024/09/09/business/dealbook/google-next-antitrust-battle.html,Google’s Next Antitrust Battle,The tech giant has lost a series of legal fights that investors have largely shrugged off. But a new trial over its advertising business could carry big consequences.,"For months, investors have largely shrugged off the mounting regulatory threat hanging over Big Tech. That calm could be tested with the Justice Department set to lock horns with Google on Monday a landmark antitrust trial on its profit engine that could add to calls that the group be broken up."
2024-09-10,https://www.nytimes.com/2024/09/10/dining/drinks/wet-martinis.html,"After Decades of Dry Martinis, It’s Great to Go Wet",The wet martini served by a new restaurant in Manhattan reflects an appreciation of vermouth that’s been a long time coming.,"Many adjectives have been attached to martinis over the years. Bartenders have plied drinkers with dirty martinis and filthy martinis, smoky martinis and flaming martinis, red-pepper martinis and blue-cheese martinis, breakfast martinis and midnight martinis. Midcentury advertising executives along Madison Avenue were weaned on dry martinis, grew into very dry martinis and graduated to extra dry. Inevitably, this produced a backlash, and in the 1990s it was common to find not just apple martinis but melon martinis, kiwi martinis, lychee martinis and other fruits."
2024-09-10,https://www.nytimes.com/2024/09/10/business/dealbook/presidential-debate-economy-wall-street.html,What Wall Street Wants to Hear at the Debate,"Taxes, tariffs, trade and regulation: Business leaders have a long list of topics they want addressed in Tuesday’s presidential showdown.","With less than two months until the presidential election, there isn’t much time left for singularly impactful moments. Tuesday’s debate between Vice President Kamala Harris and Donald Trump will be one of them — and the corporate world will be paying attention."
2024-09-16,https://www.nytimes.com/2024/09/16/business/dealbook/voters-harris-trump-economy.html,Are Voters Feeling Better About the Economy?,"After another tumultuous weekend in the presidential campaign, Americans are still largely focused on their finances, new surveys show. That could give an edge to Vice President Kamala Harris.","Donald Trump is safe and unharmed after what’s being investigated as a second assassination attempt on his life in the past two months. In fact, his campaign has referenced the incident in its latest fund-raising pitch."
2024-09-17,https://www.nytimes.com/2024/09/17/business/dealbook/fdic-bank-mergers-rules.html,Bank Mergers May Get Tougher to Do,"The F.D.I.C. is expected to vote on more stringent new rules for takeovers, while the Justice Department plans to overhaul its own guidelines.",Today could be a turning point for how regulators look at banking consolidation.
2024-09-21,https://www.nytimes.com/interactive/2024/09/21/us/politics/trump-harris-2024-election-speech.html,"Every Falsehood, Exaggeration and Untruth in Trump’s and Harris’s Stump Speeches","We fact-checked every sentence of two recent rally speeches and found that Mr. Trump spoke for almost three times as long as Ms. Harris, but told more than 10 times as many falsehoods or inaccurate statements.","We fact-checked every sentence of two recent rally speeches and found that Mr. Trump spoke for almost three times as long as Ms. Harris, but told more than 10 times as many falsehoods or inaccurate statements."
2024-09-21,https://www.nytimes.com/2024/09/21/opinion/padma-lakshmi-kamala-harris-cooking.html,"Padma Lakshmi: As a Cook, Here’s What I See in Kamala Harris","The candidate is a proud cook, and cooking is a way to connect.",I see what everyone else sees on Kamala Harris’s résumé: a history of public service that qualifies her for the presidency. But I would argue that the qualities she shows as a cook might say even more about her success as a leader.
2024-09-23,https://www.nytimes.com/interactive/2024/09/23/us/elections/times-siena-arizona-toplines.html,Toplines: September 2024 Times/Siena Poll of Arizona Registered Voters,"Results of a New York Times/Siena College poll of 713 registered voters in Arizona conducted from Sept. 17 to 21, 2024.","Results of a New York Times/Siena College poll of 713 registered voters in Arizona conducted from Sept. 17 to 21, 2024."
2024-09-23,https://www.nytimes.com/interactive/2024/09/23/us/elections/times-siena-georgia-toplines.html,Toplines: September 2024 Times/Siena Poll of Georgia Registered Voters,"Results of a New York Times/Siena College poll of 682 likely voters in Georgia conducted from Sept. 17 to 21, 2024.","Results of a New York Times/Siena College poll of 682 likely voters in Georgia conducted from Sept. 17 to 21, 2024."
2024-09-23,https://www.nytimes.com/interactive/2024/09/23/us/elections/times-siena-arizona-crosstabs.html,Cross-Tabs: September 2024 Times/Siena Poll of the Arizona Likely Electorate,"Results of a New York Times/Siena College poll of 713 likely voters in Arizona conducted from Sept. 17 to 21, 2024.","Results of a New York Times/Siena College poll of 713 likely voters in Arizona conducted from Sept. 17 to 21, 2024."
2024-09-23,https://www.nytimes.com/interactive/2024/09/23/us/elections/times-siena-north-carolina-toplines.html,Toplines: September 2024 Times/Siena Poll of North Carolina Registered Voters,"Results of a New York Times/Siena College poll of 682 registered voters in North Carolina conducted from Sept. 17 to 21, 2024.","Results of a New York Times/Siena College poll of 682 registered voters in North Carolina conducted from Sept. 17 to 21, 2024."
2024-09-23,https://www.nytimes.com/interactive/2024/09/23/us/elections/times-siena-georgia-crosstabs.html,Cross-Tabs: September 2024 Times/Siena Poll of the Georgia Likely Electorate,"Results of a New York Times/Siena College poll of 682 likely voters in Georgia conducted from Sept. 17 to 21, 2024.","Results of a New York Times/Siena College poll of 682 likely voters in Georgia conducted from Sept. 17 to 21, 2024."
2024-09-23,https://www.nytimes.com/interactive/2024/09/23/us/elections/times-siena-north-carolina-crosstabs.html,Cross-Tabs: September 2024 Times/Siena Poll of the North Carolina Likely Electorate,"Results of a New York Times/Siena College poll of 682 likely voters in North Carolina conducted from Sept. 17 to 21, 2024.","Results of a New York Times/Siena College poll of 682 likely voters in North Carolina conducted from Sept. 17 to 21, 2024."
2024-09-23,https://www.nytimes.com/interactive/2024/09/23/us/elections/times-siena-sun-belt-crosstabs.html,"Cross-Tabs: September 2024 Times/Siena Polls in Arizona, Georgia and North Carolina","Results of New York Times/Siena College polls of 2,077 likely voters in North Carolina, Georgia and Arizona conducted from Sept. 17 to 21, 2024.","Results of New York Times/Siena College polls of 2,077 likely voters in North Carolina, Georgia and Arizona conducted from Sept. 17 to 21, 2024."
2024-09-23,https://www.nytimes.com/2024/09/23/technology/ai-jim-covello-goldman-sachs.html,Will A.I. Be a Bust? A Wall Street Skeptic Rings the Alarm.,"Jim Covello, Goldman Sachs’s head of stock research, warned that building too much of what the world doesn’t need “typically ends badly.”","As Jim Covello’s car barreled up Highway 101 from San Jose to San Francisco this month, he counted the billboards about artificial intelligence. The nearly 40 signs he passed, including one that promoted something called Writer Enterprise AI and another for Speech AI, were fresh evidence, he thought, of an economic bubble."
2024-09-24,https://www.nytimes.com/2024/09/24/briefing/israel-hezbollah-lebanon.html,Israel’s Strikes on Lebanon,"We explore what led to the strikes, what’s happening now and what might come next.","Israel is now at war on its western and northern borders as a tense stalemate with Hezbollah, a militant group in Lebanon, has escalated into open conflict."
2024-09-26,https://www.nytimes.com/2024/09/26/style/steven-alan-chelsea-store.html,A King of Cool Casual’s Next Act,"With a new store, Steven Alan is trying to reconjure the magic of the boutique that put him on the fashion map.","Before Steven Alan became a designer known for his stylishly rumpled button-up shirts, he was a merchant known for his eye."
2024-09-26,https://www.nytimes.com/2024/09/26/business/dealbook/openais-altman-ai-murati.html,‘We Are Not a Normal Company’: OpenAI’s Latest Drama,"More high-level departures caught some at the high-flying A.I. start-up off guard, as the company seeks to raise billions to fund its operations and ambitious goals.","OpenAI has had more than its share of drama over the past year, even as it extends its lead in artificial intelligence."
2024-09-27,https://www.nytimes.com/2024/09/27/business/dealbook/new-york-business-eric-adams.html,The Big Apple Business View on Eric Adams,The criminal charges against the embattled mayor of New York have given corporate leaders pause about the city’s political future.,"Over the past 48 hours, the biggest spectacle for New Yorkers hasn’t been the presidential race, but rather the criminal case against Mayor Eric Adams. He was indicted Thursday on five counts, including fraud, bribery and soliciting illegal campaign donations from abroad for years."
2024-09-28,https://www.nytimes.com/interactive/2024/09/28/us/elections/times-siena-michigan-toplines.html,Toplines: September 2024 Times/Siena Poll of Michigan Registered Voters,"Results of New York Times/Siena College poll of 688 registered voters in Michigan conducted from Sept. 21 to 26, 2024.","Results of New York Times/Siena College poll of 688 registered voters in Michigan conducted from Sept. 21 to 26, 2024."
2024-09-28,https://www.nytimes.com/interactive/2024/09/28/us/elections/times-siena-rust-belt-crosstabs.html,"Cross-Tabs: September 2024 Times/Siena Polls in Michigan, Ohio and Wisconsin","Results of New York Times/Siena College polls of 2,055 likely voters in Michigan, Ohio and Wisconsin conducted from Sept. 21 to 26, 2024.","Results of New York Times/Siena College polls of 2,055 likely voters in Michigan, Ohio and Wisconsin conducted from Sept. 21 to 26, 2024."
2024-09-28,https://www.nytimes.com/interactive/2024/09/28/us/elections/times-siena-michigan-crosstabs.html,Cross-Tabs: September 2024 Times/Siena Poll of the Michigan Likely Electorate,"Results of New York Times/Siena College poll of 688 likely voters in Michigan conducted from Sept. 21 to 26, 2024.","Results of New York Times/Siena College poll of 688 likely voters in Michigan conducted from Sept. 21 to 26, 2024."
2024-09-28,https://www.nytimes.com/interactive/2024/09/28/us/elections/times-siena-ohio-toplines.html,Toplines: September 2024 Times/Siena Poll of Ohio Registered Voters,"Results of New York Times/Siena College poll of 687 registered voters in Ohio conducted from Sept. 21 to 26, 2024.","Results of New York Times/Siena College poll of 687 registered voters in Ohio conducted from Sept. 21 to 26, 2024."
2024-09-28,https://www.nytimes.com/interactive/2024/09/28/us/elections/times-siena-wisconsin-toplines.html,Toplines: September 2024 Times/Siena Poll of Wisconsin Registered Voters,"Results of New York Times/Siena College poll of 680 registered voters in Wisconsin conducted from Sept. 21 to 26, 2024.","Results of New York Times/Siena College poll of 680 registered voters in Wisconsin conducted from Sept. 21 to 26, 2024."
2024-09-28,https://www.nytimes.com/interactive/2024/09/28/us/elections/times-siena-ohio-crosstabs.html,Cross-Tabs: September 2024 Times/Siena Poll of the Ohio Likely Electorate,"Results of New York Times/Siena College poll of 687 likely voters in Ohio conducted from Sept. 21 to 26, 2024.","Results of New York Times/Siena College poll of 687 likely voters in Ohio conducted from Sept. 21 to 26, 2024."
2024-09-28,https://www.nytimes.com/interactive/2024/09/28/us/elections/times-siena-wisconsin-crosstabs.html,Cross-Tabs: September 2024 Times/Siena Poll of the Wisconsin Likely Electorate,"Results of New York Times/Siena College poll of 680 likely voters in Wisconsin conducted from Sept. 21 to 26, 2024.","Results of New York Times/Siena College poll of 680 likely voters in Wisconsin conducted from Sept. 21 to 26, 2024."
2024-09-30,https://www.nytimes.com/2024/09/30/opinion/american-businesses-china.html,Breaking Up With China Is Hard to Do,"For many U.S. companies, Chinese partnership may be too important to quit.","It’s not an easy time to be an American multinational company that sells to or buys from China. As the governments of the United States and China butt heads, they’re pressuring companies to take sides."
2024-10-01,https://www.nytimes.com/2024/10/01/arts/television/october-streaming-movies-shows.html,"The Best Movies and TV Shows Coming to Disney+, Amazon, Apple TV+ and More in October","“Citadel: Diana,” “Disclaimer,” “The Franchise,” “Star Trek: Lower Decks,” a Springsteen documentary and others arrive.","Every month, streaming services add movies and TV shows to their libraries. Here are our picks for some of October’s most promising new titles. (Note: Streaming services occasionally change schedules without giving notice. For more recommendations on what to stream, sign up for our Watching newsletter here.)"
2024-10-02,https://www.nytimes.com/2024/10/02/briefing/new-evidence-trump-case-biden-helene.html,New Evidence Was Unsealed in the Federal Election Case Against Trump,"Also, Biden ordered 1,000 troops to help areas destroyed by Helene. Here’s the latest at the end of Wednesday.",A federal judge in Washington made public portions of a sprawling legal brief in which prosecutors provided the fullest picture yet of what they found in their investigation of Donald Trump’s attempts to overturn the 2020 election. 
2024-10-03,https://www.nytimes.com/2024/10/03/briefing/how-trump-could-punish-his-enemies.html,How Trump Could Punish His Enemies,We look at why legal experts are concerned.,"Donald Trump says Kamala Harris should be prosecuted for the Biden administration’s border policies. He wants President Biden to be prosecuted for corruption, Nancy Pelosi for her husband’s stock trades and Google for its search results about Trump and Harris. His list of targets for investigation also includes state prosecutors, judges and former officials from the F.B.I. and other parts of the Justice Department."
2024-10-05,https://www.nytimes.com/2024/10/05/briefing/fear-factors.html,Fear Factors,Sometimes the scariest movies are the ones that depict the ordinary horrors of life.,"I was fascinated to discover recently that each October, my friend Alex undertakes a spooky-season film festival, endeavoring to watch one horror flick for each day of the month. I do not expect that his roster includes the 2012 documentary “Part of Me,” a chronicle of the musician Katy Perry’s California Dreams concert tour. But I happened to watch that film this week, and it made me contemplate what, exactly, makes a movie frightening."
2024-10-07,https://www.nytimes.com/2024/10/07/magazine/netflix-library-viewer-numbers.html,How Everyone Got Lost in Netflix’s Endless Library,"Ten years after Silicon Valley remade TV, it’s become clear how the streaming revolution distorted our collective viewing habits — and sense of the culture.","If you take a journey deep within Netflix’s furthest recesses — burrow past Bingeworthy TV Dramas and 1980s Action Thrillers, take a left at Because You Watched the Lego Batman Movie, keep going past Fright Night — you will eventually find your way to the platform’s core, the forgotten layers of content fossilized by the pressure from the accreted layers above. Down here, if you search hard enough, you will eventually find your way to “Richie Rich.”"
2024-10-08,https://www.nytimes.com/interactive/2024/10/13/us/elections/times-siena-poll-florida-crosstabs.html,Cross-Tabs: October 2024 Times/Siena Poll of the Likely Electorate in Florida,"Results of a New York Times/Siena College poll conducted among 622 likely voters in Florida from Sept. 29 to Oct. 6, 2024.","Results of a New York Times/Siena College poll conducted among 622 likely voters in Florida from Sept. 29 to Oct. 6, 2024."
2024-10-08,https://www.nytimes.com/interactive/2024/10/13/us/elections/times-siena-poll-likely-electorate-crosstabs.html,Cross-Tabs: October 2024 Times/Siena Poll of the National Likely Electorate,"Results of a nationwide New York Times/Siena College poll conducted among 3,385 likely voters from Sept. 29 to Oct. 6, 2024.","Results of a nationwide New York Times/Siena College poll conducted among 3,385 likely voters from Sept. 29 to Oct. 6, 2024."
2024-10-08,https://www.nytimes.com/interactive/2024/10/13/us/elections/times-siena-poll-florida-toplines.html,Toplines: October 2024 Times/Siena Poll of Registered Voters in Florida,"Results of a New York Times/Siena College poll conducted among 622 registered voters in Florida from Sept. 29 to Oct. 6, 2024.","Results of a New York Times/Siena College poll conducted among 622 registered voters in Florida from Sept. 29 to Oct. 6, 2024."
